{"$schema":"https://json-schema.org/draft/2020-12/schema","type":"object","additionalProperties":false,"required":["schemaVersion","contentVersion","materialId","lessons"],"properties":{"schemaVersion":{"const":"1.0.0"},"contentVersion":{"type":"integer","minimum":1},"materialId":{"type":"string","pattern":"^youtube-[A-Za-z0-9_-]{11}$"},"lessons":{"type":"array","minItems":1,"items":{"type":"object","additionalProperties":false,"required":["id","order","title","startSeconds","endSeconds","priority","summary","retentionPoints"],"properties":{"id":{"type":"string","minLength":1},"order":{"type":"integer","minimum":1},"title":{"type":"string","minLength":1},"startSeconds":{"type":"integer","minimum":0},"endSeconds":{"type":"integer","minimum":1},"priority":{"enum":["high","standard"]},"summary":{"type":"string","minLength":1},"retentionPoints":{"type":"array","minItems":1,"items":{"type":"string","minLength":1}},"prompt":{"type":["string","null"]},"steps":{"type":"array","items":{"type":"string","minLength":1}},"tools":{"type":"array","items":{"type":"object","additionalProperties":false,"required":["name"],"properties":{"name":{"type":"string","minLength":1},"url":{"type":"string","format":"uri"}}}}}}}}}
